stdout: 09:02:39.138798 00:1e:c2:bd:64:9b (oui Unknown) > Broadcast, ethertype IPv4 (0x0800), length 148: 10.167.2.121.17500 > broadcasthost.17500: UDP, length 106
09:02:39.140644 00:1e:c2:bd:64:9b (oui Unknown) > Broadcast, ethertype IPv4 (0x0800), length 148: 10.167.2.121.17500 > 10.167.2.127.17500: UDP, length 106
09:02:40.443915 00:40:05:7b:f9:f4 (oui Unknown) > 00:1b:63:cb:f8:d1 (oui Unknown), ethertype IPv4 (0x0800), length 161: card.freenode.net.6667 > 10.167.2.70.53226: Flags [P.], seq 394429941:394430036, ack 844688083, win 108, options [nop,nop,TS val 1561907157 ecr 468532464], length 95
09:02:40.444022 00:1b:63:cb:f8:d1 (oui Unknown) > 00:40:05:7b:f9:f4 (oui Unknown), ethertype IPv4 (0x0800), length 66: 10.167.2.70.53226 > card.freenode.net.6667: Flags [.], ack 95, win 65535, options [nop,nop,TS val 468532857 ecr 1561907157], length 0
09:02:47.842329 00:1e:c2:bd:64:9b (oui Unknown) > 01:00:5e:00:00:fb (oui Unknown), ethertype IPv4 (0x0800), length 82: 10.167.2.121.mdns > 224.0.0.251.mdns: 0 PTR (QM)? _1password2._tcp.local. (40)
09:02:47.843761 00:1e:c2:bd:64:9b (oui Unknown) > 33:33:00:00:00:fb (oui Unknown), ethertype IPv6 (0x86dd), length 102: c8h10n4o2.local.mdns > ff02::fb.mdns: 0 PTR (QM)? _1password2._tcp.local. (40)
09:02:50.763937 00:1b:63:cb:f8:d1 (oui Unknown) > 00:40:05:7b:f9:f4 (oui Unknown), ethertype IPv4 (0x0800), length 167: 10.167.2.70.53204 > jabber.headshift.com.jabber-client: Flags [P.], seq 3196320105:3196320206, ack 2214686640, win 65535, options [nop,nop,TS val 468532960 ecr 792380625], length 101
09:02:50.795583 00:40:05:7b:f9:f4 (oui Unknown) > 00:1b:63:cb:f8:d1 (oui Unknown), ethertype IPv4 (0x0800), length 183: jabber.headshift.com.jabber-client > 10.167.2.70.53204: Flags [P.], seq 1:118, ack 101, win 208, options [nop,nop,TS val 792388125 ecr 468532960], length 117
09:02:50.795674 00:1b:63:cb:f8:d1 (oui Unknown) > 00:40:05:7b:f9:f4 (oui Unknown), ethertype IPv4 (0x0800), length 66: 10.167.2.70.53204 > jabber.headshift.com.jabber-client: Flags [.], ack 118, win 65535, options [nop,nop,TS val 468532961 ecr 792388125], length 0
09:02:51.691082 00:1b:63:cb:f8:d1 (oui Unknown) > 00:40:05:7b:f9:f4 (oui Unknown), ethertype IPv4 (0x0800), length 78: 10.167.2.70.53326 > amung.us.http: Flags [S], seq 2139360404, win 65535, options [mss 1460,nop,wscale 3,nop,nop,TS val 468532969 ecr 0,sackOK,eol], length 0
09:02:51.941415 00:1b:63:cb:f8:d1 (oui Unknown) > 00:40:05:7b:f9:f4 (oui Unknown), ethertype IPv4 (0x0800), length 78: 10.167.2.70.53327 > amung.us.http: Flags [S], seq 963090057, win 65535, options [mss 1460,nop,wscale 3,nop,nop,TS val 468532972 ecr 0,sackOK,eol], length 0
09:02:52.058467 00:40:05:7b:f9:f4 (oui Unknown) > 00:1b:63:cb:f8:d1 (oui Unknown), ethertype IPv4 (0x0800), length 74: amung.us.http > 10.167.2.70.53327: Flags [S.], seq 3279926793, ack 963090058, win 2896, options [mss 1460,sackOK,TS val 1695529767 ecr 468532972,nop,wscale 1], length 0
09:02:52.058886 00:1b:63:cb:f8:d1 (oui Unknown) > 00:40:05:7b:f9:f4 (oui Unknown), ethertype IPv4 (0x0800), length 66: 10.167.2.70.53327 > amung.us.http: Flags [.], ack 1, win 65535, options [nop,nop,TS val 468532973 ecr 1695529767], length 0
09:02:52.059398 00:1b:63:cb:f8:d1 (oui Unknown) > 00:40:05:7b:f9:f4 (oui Unknown), ethertype IPv4 (0x0800), length 611: 10.167.2.70.53327 > amung.us.http: Flags [P.], seq 1:546, ack 1, win 65535, options [nop,nop,TS val 468532973 ecr 1695529767], length 545
09:02:52.185116 00:40:05:7b:f9:f4 (oui Unknown) > 00:1b:63:cb:f8:d1 (oui Unknown), ethertype IPv4 (0x0800), length 1514: amung.us.http > 10.167.2.70.53327: Flags [.], seq 1:1449, ack 546, win 1993, options [nop,nop,TS val 1695529798 ecr 468532973], length 1448
09:02:52.185629 00:40:05:7b:f9:f4 (oui Unknown) > 00:1b:63:cb:f8:d1 (oui Unknown), ethertype IPv4 (0x0800), length 392: amung.us.http > 10.167.2.70.53327: Flags [F.], seq 1449:1775, ack 546, win 1993, options [nop,nop,TS val 1695529798 ecr 468532973], length 326
09:02:52.185731 00:1b:63:cb:f8:d1 (oui Unknown) > 00:40:05:7b:f9:f4 (oui Unknown), ethertype IPv4 (0x0800), length 66: 10.167.2.70.53327 > amung.us.http: Flags [.], ack 1776, win 65535, options [nop,nop,TS val 468532974 ecr 1695529798], length 0
09:02:52.187249 00:1b:63:cb:f8:d1 (oui Unknown) > 00:40:05:7b:f9:f4 (oui Unknown), ethertype IPv4 (0x0800), length 66: 10.167.2.70.53327 > amung.us.http: Flags [F.], seq 546, ack 1776, win 65535, options [nop,nop,TS val 468532974 ecr 1695529798], length 0
09:02:52.304550 00:40:05:7b:f9:f4 (oui Unknown) > 00:1b:63:cb:f8:d1 (oui Unknown), ethertype IPv4 (0x0800), length 66: amung.us.http > 10.167.2.70.53327: Flags [.], ack 547, win 1993, options [nop,nop,TS val 1695529828 ecr 468532974], length 0
09:02:52.592507 00:1b:63:cb:f8:d1 (oui Unknown) > 00:40:05:7b:f9:f4 (oui Unknown), ethertype IPv4 (0x0800), length 78: 10.167.2.70.53326 > amung.us.http: Flags [S], seq 2139360404, win 65535, options [mss 1460,nop,wscale 3,nop,nop,TS val 468532978 ecr 0,sackOK,eol], length 0
09:02:52.608609 00:1b:63:cb:f8:d1 (oui Unknown) > Broadcast, ethertype IPv4 (0x0800), length 372: 10.167.2.70.17500 > broadcasthost.17500: UDP, length 330
09:02:52.609405 00:1b:63:cb:f8:d1 (oui Unknown) > Broadcast, ethertype IPv4 (0x0800), length 372: 10.167.2.70.17500 > 10.167.2.127.17500: UDP, length 330
09:02:52.709688 00:40:05:7b:f9:f4 (oui Unknown) > 00:1b:63:cb:f8:d1 (oui Unknown), ethertype IPv4 (0x0800), length 74: amung.us.http > 10.167.2.70.53326: Flags [S.], seq 3280556139, ack 2139360405, win 2896, options [mss 1460,sackOK,TS val 1695529930 ecr 468532978,nop,wscale 1], length 0
09:02:52.709773 00:1b:63:cb:f8:d1 (oui Unknown) > 00:40:05:7b:f9:f4 (oui Unknown), ethertype IPv4 (0x0800), length 66: 10.167.2.70.53326 > amung.us.http: Flags [.], ack 1, win 65535, options [nop,nop,TS val 468532980 ecr 1695529930], length 0
09:02:56.049641 00:40:05:7b:f9:f4 (oui Unknown) > 00:1b:63:cb:f8:d1 (oui Unknown), ethertype IPv4 (0x0800), length 74: amung.us.http > 10.167.2.70.53326: Flags [S.], seq 3280556139, ack 2139360405, win 2896, options [mss 1460,sackOK,TS val 1695530765 ecr 468532980,nop,wscale 1], length 0
09:02:56.049717 00:1b:63:cb:f8:d1 (oui Unknown) > 00:40:05:7b:f9:f4 (oui Unknown), ethertype IPv4 (0x0800), length 66: 10.167.2.70.53326 > amung.us.http: Flags [.], ack 1, win 65535, options [nop,nop,TS val 468533013 ecr 1695530765], length 0
09:02:56.522501 00:40:05:7b:f9:f4 (oui Unknown) > 00:1b:63:cb:f8:d1 (oui Unknown), ethertype IPv4 (0x0800), length 120: card.freenode.net.6667 > 10.167.2.70.53226: Flags [P.], seq 95:149, ack 1, win 108, options [nop,nop,TS val 1561911177 ecr 468532857], length 54
09:02:56.522682 00:1b:63:cb:f8:d1 (oui Unknown) > 00:40:05:7b:f9:f4 (oui Unknown), ethertype IPv4 (0x0800), length 66: 10.167.2.70.53226 > card.freenode.net.6667: Flags [.], ack 149, win 65535, options [nop,nop,TS val 468533018 ecr 1561911177], length 0
09:02:56.642055 00:40:05:7b:f9:f4 (oui Unknown) > 00:1b:63:cb:f8:d1 (oui Unknown), ethertype IPv4 (0x0800), length 192: card.freenode.net.6667 > 10.167.2.70.53226: Flags [P.], seq 149:275, ack 1, win 108, options [nop,nop,TS val 1561911206 ecr 468533018], length 126
09:02:56.642333 00:1b:63:cb:f8:d1 (oui Unknown) > 00:40:05:7b:f9:f4 (oui Unknown), ethertype IPv4 (0x0800), length 66: 10.167.2.70.53226 > card.freenode.net.6667: Flags [.], ack 275, win 65535, options [nop,nop,TS val 468533019 ecr 1561911206], length 0
09:03:02.390359 00:1b:63:cb:f8:d1 (oui Unknown) > 00:40:05:7b:f9:f4 (oui Unknown), ethertype IPv4 (0x0800), length 78: 10.167.2.70.53328 > ec2-184-73-194-227.compute-1.amazonaws.com.http: Flags [S], seq 763772475, win 65535, options [mss 1460,nop,wscale 3,nop,nop,TS val 468533076 ecr 0,sackOK,eol], length 0
09:03:02.484719 00:40:05:7b:f9:f4 (oui Unknown) > 00:1b:63:cb:f8:d1 (oui Unknown), ethertype IPv4 (0x0800), length 74: ec2-184-73-194-227.compute-1.amazonaws.com.http > 10.167.2.70.53328: Flags [S.], seq 2643310242, ack 763772476, win 5792, options [mss 1460,sackOK,TS val 177607853 ecr 468533076,nop,wscale 7], length 0
09:03:02.484778 00:1b:63:cb:f8:d1 (oui Unknown) > 00:40:05:7b:f9:f4 (oui Unknown), ethertype IPv4 (0x0800), length 66: 10.167.2.70.53328 > ec2-184-73-194-227.compute-1.amazonaws.com.http: Flags [.], ack 1, win 65535, options [nop,nop,TS val 468533077 ecr 177607853], length 0
09:03:02.484976 00:1b:63:cb:f8:d1 (oui Unknown) > 00:40:05:7b:f9:f4 (oui Unknown), ethertype IPv4 (0x0800), length 697: 10.167.2.70.53328 > ec2-184-73-194-227.compute-1.amazonaws.com.http: Flags [P.], seq 1:632, ack 1, win 65535, options [nop,nop,TS val 468533077 ecr 177607853], length 631
09:03:02.584567 00:40:05:7b:f9:f4 (oui Unknown) > 00:1b:63:cb:f8:d1 (oui Unknown), ethertype IPv4 (0x0800), length 66: ec2-184-73-194-227.compute-1.amazonaws.com.http > 10.167.2.70.53328: Flags [.], ack 632, win 56, options [nop,nop,TS val 177607862 ecr 468533077], length 0
09:03:02.588201 00:40:05:7b:f9:f4 (oui Unknown) > 00:1b:63:cb:f8:d1 (oui Unknown), ethertype IPv4 (0x0800), length 292: ec2-184-73-194-227.compute-1.amazonaws.com.http > 10.167.2.70.53328: Flags [P.], seq 1:227, ack 632, win 56, options [nop,nop,TS val 177607862 ecr 468533077], length 226
09:03:02.588304 00:1b:63:cb:f8:d1 (oui Unknown) > 00:40:05:7b:f9:f4 (oui Unknown), ethertype IPv4 (0x0800), length 66: 10.167.2.70.53328 > ec2-184-73-194-227.compute-1.amazonaws.com.http: Flags [.], ack 227, win 65535, options [nop,nop,TS val 468533078 ecr 177607862], length 0
09:03:02.588850 00:40:05:7b:f9:f4 (oui Unknown) > 00:1b:63:cb:f8:d1 (oui Unknown), ethertype IPv4 (0x0800), length 66: ec2-184-73-194-227.compute-1.amazonaws.com.http > 10.167.2.70.53328: Flags [F.], seq 227, ack 632, win 56, options [nop,nop,TS val 177607862 ecr 468533077], length 0
09:03:02.588892 00:1b:63:cb:f8:d1 (oui Unknown) > 00:40:05:7b:f9:f4 (oui Unknown), ethertype IPv4 (0x0800), length 66: 10.167.2.70.53328 > ec2-184-73-194-227.compute-1.amazonaws.com.http: Flags [F.], seq 632, ack 227, win 65535, options [nop,nop,TS val 468533078 ecr 177607862], length 0
09:03:02.588950 00:1b:63:cb:f8:d1 (oui Unknown) > 00:40:05:7b:f9:f4 (oui Unknown), ethertype IPv4 (0x0800), length 66: 10.167.2.70.53328 > ec2-184-73-194-227.compute-1.amazonaws.com.http: Flags [F.], seq 632, ack 228, win 65535, options [nop,nop,TS val 468533078 ecr 177607862], length 0
09:03:02.683569 00:40:05:7b:f9:f4 (oui Unknown) > 00:1b:63:cb:f8:d1 (oui Unknown), ethertype IPv4 (0x0800), length 66: ec2-184-73-194-227.compute-1.amazonaws.com.http > 10.167.2.70.53328: Flags [.], ack 633, win 56, options [nop,nop,TS val 177607872 ecr 468533078], length 0
09:03:02.683616 00:1b:63:cb:f8:d1 (oui Unknown) > 00:40:05:7b:f9:f4 (oui Unknown), ethertype IPv4 (0x0800), length 66: 10.167.2.70.53328 > ec2-184-73-194-227.compute-1.amazonaws.com.http: Flags [.], ack 228, win 65535, options [nop,nop,TS val 468533079 ecr 177607872], length 0
09:03:03.270425 00:1b:63:cb:f8:d1 (oui Unknown) > 00:11:11:49:5b:d6 (oui Unknown), ethertype IPv4 (0x0800), length 87: 10.167.2.70.62342 > 10.167.2.68.domain: 16345+ PTR? 227.194.73.184.in-addr.arpa. (45)
09:03:03.330606 00:11:11:49:5b:d6 (oui Unknown) > 00:1b:63:cb:f8:d1 (oui Unknown), ethertype IPv4 (0x0800), length 143: 10.167.2.68.domain > 10.167.2.70.62342: 16345 1/0/0 PTR ec2-184-73-194-227.compute-1.amazonaws.com. (101)
09:03:09.142006 00:1e:c2:bd:64:9b (oui Unknown) > Broadcast, ethertype IPv4 (0x0800), length 148: 10.167.2.121.17500 > broadcasthost.17500: UDP, length 106
09:03:09.143986 00:1e:c2:bd:64:9b (oui Unknown) > Broadcast, ethertype IPv4 (0x0800), length 148: 10.167.2.121.17500 > 10.167.2.127.17500: UDP, length 106
09:03:09.862954 00:40:05:7b:f9:f4 (oui Unknown) > 00:1b:63:cb:f8:d1 (oui Unknown), ethertype IPv4 (0x0800), length 264: 208.43.202.27-static.reverse.softlayer.com.http > 10.167.2.70.50616: Flags [P.], seq 3024919684:3024919882, ack 117802023, win 501, options [nop,nop,TS val 2552267196 ecr 468532410], length 198
09:03:09.863017 00:1b:63:cb:f8:d1 (oui Unknown) > 00:40:05:7b:f9:f4 (oui Unknown), ethertype IPv4 (0x0800), length 66: 10.167.2.70.50616 > 208.43.202.27-static.reverse.softlayer.com.http: Flags [.], ack 198, win 65535, options [nop,nop,TS val 468533151 ecr 2552267196], length 0
09:03:09.866970 00:1b:63:cb:f8:d1 (oui Unknown) > 00:40:05:7b:f9:f4 (oui Unknown), ethertype IPv4 (0x0800), length 812: 10.167.2.70.50616 > 208.43.202.27-static.reverse.softlayer.com.http: Flags [P.], seq 1:747, ack 198, win 65535, options [nop,nop,TS val 468533151 ecr 2552267196], length 746
09:03:09.998102 00:40:05:7b:f9:f4 (oui Unknown) > 00:1b:63:cb:f8:d1 (oui Unknown), ethertype IPv4 (0x0800), length 66: 208.43.202.27-static.reverse.softlayer.com.http > 10.167.2.70.50616: Flags [.], ack 747, win 501, options [nop,nop,TS val 2552267230 ecr 468533151], length 0
09:03:10.584708 00:1b:63:cb:f8:d1 (oui Unknown) > 00:40:05:7b:f9:f4 (oui Unknown), ethertype IPv4 (0x0800), length 66: 10.167.2.70.53326 > amung.us.http: Flags [F.], seq 1, ack 1, win 65535, options [nop,nop,TS val 468533158 ecr 1695530765], length 0
09:03:10.703308 00:40:05:7b:f9:f4 (oui Unknown) > 00:1b:63:cb:f8:d1 (oui Unknown), ethertype IPv4 (0x0800), length 56: amung.us.http > 10.167.2.70.53326: Flags [R], seq 3280556140, win 0, length 0
09:03:11.707274 00:1b:63:cb:f8:d1 (oui Unknown) > 00:40:05:7b:f9:f4 (oui Unknown), ethertype IPv4 (0x0800), length 78: 10.167.2.70.53329 > amung.us.http: Flags [S], seq 187958398, win 65535, options [mss 1460,nop,wscale 3,nop,nop,TS val 468533169 ecr 0,sackOK,eol], length 0
09:03:11.823218 00:40:05:7b:f9:f4 (oui Unknown) > 00:1b:63:cb:f8:d1 (oui Unknown), ethertype IPv4 (0x0800), length 74: amung.us.http > 10.167.2.70.53329: Flags [S.], seq 3584377101, ack 187958399, win 2896, options [mss 1460,sackOK,TS val 1695534708 ecr 468533169,nop,wscale 1], length 0
09:03:11.823591 00:1b:63:cb:f8:d1 (oui Unknown) > 00:40:05:7b:f9:f4 (oui Unknown), ethertype IPv4 (0x0800), length 66: 10.167.2.70.53329 > amung.us.http: Flags [.], ack 1, win 65535, options [nop,nop,TS val 468533171 ecr 1695534708], length 0
09:03:11.823822 00:1b:63:cb:f8:d1 (oui Unknown) > 00:40:05:7b:f9:f4 (oui Unknown), ethertype IPv4 (0x0800), length 610: 10.167.2.70.53329 > amung.us.http: Flags [P.], seq 1:545, ack 1, win 65535, options [nop,nop,TS val 468533171 ecr 1695534708], length 544
09:03:11.951740 00:40:05:7b:f9:f4 (oui Unknown) > 00:1b:63:cb:f8:d1 (oui Unknown), ethertype IPv4 (0x0800), length 1514: amung.us.http > 10.167.2.70.53329: Flags [.], seq 1:1449, ack 545, win 1992, options [nop,nop,TS val 1695534740 ecr 468533171], length 1448
09:03:11.952036 00:40:05:7b:f9:f4 (oui Unknown) > 00:1b:63:cb:f8:d1 (oui Unknown), ethertype IPv4 (0x0800), length 359: amung.us.http > 10.167.2.70.53329: Flags [F.], seq 1449:1742, ack 545, win 1992, options [nop,nop,TS val 1695534740 ecr 468533171], length 293
09:03:11.952118 00:1b:63:cb:f8:d1 (oui Unknown) > 00:40:05:7b:f9:f4 (oui Unknown), ethertype IPv4 (0x0800), length 66: 10.167.2.70.53329 > amung.us.http: Flags [.], ack 1743, win 65485, options [nop,nop,TS val 468533172 ecr 1695534740], length 0
09:03:11.952721 00:1b:63:cb:f8:d1 (oui Unknown) > 00:40:05:7b:f9:f4 (oui Unknown), ethertype IPv4 (0x0800), length 66: 10.167.2.70.53329 > amung.us.http: Flags [F.], seq 545, ack 1743, win 65535, options [nop,nop,TS val 468533172 ecr 1695534740], length 0
09:03:12.069400 00:40:05:7b:f9:f4 (oui Unknown) > 00:1b:63:cb:f8:d1 (oui Unknown), ethertype IPv4 (0x0800), length 66: amung.us.http > 10.167.2.70.53329: Flags [.], ack 546, win 1992, options [nop,nop,TS val 1695534770 ecr 468533172], length 0
09:03:15.233861 00:40:05:7b:f9:f4 (oui Unknown) > 00:1b:63:cb:f8:d1 (oui Unknown), ethertype IPv4 (0x0800), length 129: card.freenode.net.6667 > 10.167.2.70.53226: Flags [P.], seq 275:338, ack 1, win 108, options [nop,nop,TS val 1561915855 ecr 468533019], length 63
09:03:15.234110 00:1b:63:cb:f8:d1 (oui Unknown) > 00:40:05:7b:f9:f4 (oui Unknown), ethertype IPv4 (0x0800), length 66: 10.167.2.70.53226 > card.freenode.net.6667: Flags [.], ack 338, win 65535, options [nop,nop,TS val 468533205 ecr 1561915855], length 0
09:03:20.764637 00:1b:63:cb:f8:d1 (oui Unknown) > 00:40:05:7b:f9:f4 (oui Unknown), ethertype IPv4 (0x0800), length 167: 10.167.2.70.53204 > jabber.headshift.com.jabber-client: Flags [P.], seq 101:202, ack 118, win 65535, options [nop,nop,TS val 468533260 ecr 792388125], length 101
09:03:20.791869 00:40:05:7b:f9:f4 (oui Unknown) 
stdout: 09:02:39.138798 00:1e:c2:bd:64:9b (oui Unknown) > Broadcast, ethertype IPv4 (0x0800), length 148: 10.167.2.121.17500 > broadcasthost.17500: UDP, length 106
09:02:39.140644 00:1e:c2:bd:64:9b (oui Unknown) > Broadcast, ethertype IPv4 (0x0800), length 148: 10.167.2.121.17500 > 10.167.2.127.17500: UDP, length 106
09:02:40.443915 00:40:05:7b:f9:f4 (oui Unknown) > 00:1b:63:cb:f8:d1 (oui Unknown), ethertype IPv4 (0x0800), length 161: card.freenode.net.6667 > 10.167.2.70.53226: Flags [P.], seq 394429941:394430036, ack 844688083, win 108, options [nop,nop,TS val 1561907157 ecr 468532464], length 95
09:02:40.444022 00:1b:63:cb:f8:d1 (oui Unknown) > 00:40:05:7b:f9:f4 (oui Unknown), ethertype IPv4 (0x0800), length 66: 10.167.2.70.53226 > card.freenode.net.6667: Flags [.], ack 95, win 65535, options [nop,nop,TS val 468532857 ecr 1561907157], length 0
09:02:47.842329 00:1e:c2:bd:64:9b (oui Unknown) > 01:00:5e:00:00:fb (oui Unknown), ethertype IPv4 (0x0800), length 82: 10.167.2.121.mdns > 224.0.0.251.mdns: 0 PTR (QM)? _1password2._tcp.local. (40)
09:02:47.843761 00:1e:c2:bd:64:9b (oui Unknown) > 33:33:00:00:00:fb (oui Unknown), ethertype IPv6 (0x86dd), length 102: c8h10n4o2.local.mdns > ff02::fb.mdns: 0 PTR (QM)? _1password2._tcp.local. (40)
09:02:50.763937 00:1b:63:cb:f8:d1 (oui Unknown) > 00:40:05:7b:f9:f4 (oui Unknown), ethertype IPv4 (0x0800), length 167: 10.167.2.70.53204 > jabber.headshift.com.jabber-client: Flags [P.], seq 3196320105:3196320206, ack 2214686640, win 65535, options [nop,nop,TS val 468532960 ecr 792380625], length 101
09:02:50.795583 00:40:05:7b:f9:f4 (oui Unknown) > 00:1b:63:cb:f8:d1 (oui Unknown), ethertype IPv4 (0x0800), length 183: jabber.headshift.com.jabber-client > 10.167.2.70.53204: Flags [P.], seq 1:118, ack 101, win 208, options [nop,nop,TS val 792388125 ecr 468532960], length 117
09:02:50.795674 00:1b:63:cb:f8:d1 (oui Unknown) > 00:40:05:7b:f9:f4 (oui Unknown), ethertype IPv4 (0x0800), length 66: 10.167.2.70.53204 > jabber.headshift.com.jabber-client: Flags [.], ack 118, win 65535, options [nop,nop,TS val 468532961 ecr 792388125], length 0
09:02:51.691082 00:1b:63:cb:f8:d1 (oui Unknown) > 00:40:05:7b:f9:f4 (oui Unknown), ethertype IPv4 (0x0800), length 78: 10.167.2.70.53326 > amung.us.http: Flags [S], seq 2139360404, win 65535, options [mss 1460,nop,wscale 3,nop,nop,TS val 468532969 ecr 0,sackOK,eol], length 0
09:02:51.941415 00:1b:63:cb:f8:d1 (oui Unknown) > 00:40:05:7b:f9:f4 (oui Unknown), ethertype IPv4 (0x0800), length 78: 10.167.2.70.53327 > amung.us.http: Flags [S], seq 963090057, win 65535, options [mss 1460,nop,wscale 3,nop,nop,TS val 468532972 ecr 0,sackOK,eol], length 0
09:02:52.058467 00:40:05:7b:f9:f4 (oui Unknown) > 00:1b:63:cb:f8:d1 (oui Unknown), ethertype IPv4 (0x0800), length 74: amung.us.http > 10.167.2.70.53327: Flags [S.], seq 3279926793, ack 963090058, win 2896, options [mss 1460,sackOK,TS val 1695529767 ecr 468532972,nop,wscale 1], length 0
09:02:52.058886 00:1b:63:cb:f8:d1 (oui Unknown) > 00:40:05:7b:f9:f4 (oui Unknown), ethertype IPv4 (0x0800), length 66: 10.167.2.70.53327 > amung.us.http: Flags [.], ack 1, win 65535, options [nop,nop,TS val 468532973 ecr 1695529767], length 0
09:02:52.059398 00:1b:63:cb:f8:d1 (oui Unknown) > 00:40:05:7b:f9:f4 (oui Unknown), ethertype IPv4 (0x0800), length 611: 10.167.2.70.53327 > amung.us.http: Flags [P.], seq 1:546, ack 1, win 65535, options [nop,nop,TS val 468532973 ecr 1695529767], length 545
09:02:52.185116 00:40:05:7b:f9:f4 (oui Unknown) > 00:1b:63:cb:f8:d1 (oui Unknown), ethertype IPv4 (0x0800), length 1514: amung.us.http > 10.167.2.70.53327: Flags [.], seq 1:1449, ack 546, win 1993, options [nop,nop,TS val 1695529798 ecr 468532973], length 1448
09:02:52.185629 00:40:05:7b:f9:f4 (oui Unknown) > 00:1b:63:cb:f8:d1 (oui Unknown), ethertype IPv4 (0x0800), length 392: amung.us.http > 10.167.2.70.53327: Flags [F.], seq 1449:1775, ack 546, win 1993, options [nop,nop,TS val 1695529798 ecr 468532973], length 326
09:02:52.185731 00:1b:63:cb:f8:d1 (oui Unknown) > 00:40:05:7b:f9:f4 (oui Unknown), ethertype IPv4 (0x0800), length 66: 10.167.2.70.53327 > amung.us.http: Flags [.], ack 1776, win 65535, options [nop,nop,TS val 468532974 ecr 1695529798], length 0
09:02:52.187249 00:1b:63:cb:f8:d1 (oui Unknown) > 00:40:05:7b:f9:f4 (oui Unknown), ethertype IPv4 (0x0800), length 66: 10.167.2.70.53327 > amung.us.http: Flags [F.], seq 546, ack 1776, win 65535, options [nop,nop,TS val 468532974 ecr 1695529798], length 0
09:02:52.304550 00:40:05:7b:f9:f4 (oui Unknown) > 00:1b:63:cb:f8:d1 (oui Unknown), ethertype IPv4 (0x0800), length 66: amung.us.http > 10.167.2.70.53327: Flags [.], ack 547, win 1993, options [nop,nop,TS val 1695529828 ecr 468532974], length 0
09:02:52.592507 00:1b:63:cb:f8:d1 (oui Unknown) > 00:40:05:7b:f9:f4 (oui Unknown), ethertype IPv4 (0x0800), length 78: 10.167.2.70.53326 > amung.us.http: Flags [S], seq 2139360404, win 65535, options [mss 1460,nop,wscale 3,nop,nop,TS val 468532978 ecr 0,sackOK,eol], length 0
09:02:52.608609 00:1b:63:cb:f8:d1 (oui Unknown) > Broadcast, ethertype IPv4 (0x0800), length 372: 10.167.2.70.17500 > broadcasthost.17500: UDP, length 330
09:02:52.609405 00:1b:63:cb:f8:d1 (oui Unknown) > Broadcast, ethertype IPv4 (0x0800), length 372: 10.167.2.70.17500 > 10.167.2.127.17500: UDP, length 330
09:02:52.709688 00:40:05:7b:f9:f4 (oui Unknown) > 00:1b:63:cb:f8:d1 (oui Unknown), ethertype IPv4 (0x0800), length 74: amung.us.http > 10.167.2.70.53326: Flags [S.], seq 3280556139, ack 2139360405, win 2896, options [mss 1460,sackOK,TS val 1695529930 ecr 468532978,nop,wscale 1], length 0
09:02:52.709773 00:1b:63:cb:f8:d1 (oui Unknown) > 00:40:05:7b:f9:f4 (oui Unknown), ethertype IPv4 (0x0800), length 66: 10.167.2.70.53326 > amung.us.http: Flags [.], ack 1, win 65535, options [nop,nop,TS val 468532980 ecr 1695529930], length 0
09:02:56.049641 00:40:05:7b:f9:f4 (oui Unknown) > 00:1b:63:cb:f8:d1 (oui Unknown), ethertype IPv4 (0x0800), length 74: amung.us.http > 10.167.2.70.53326: Flags [S.], seq 3280556139, ack 2139360405, win 2896, options [mss 1460,sackOK,TS val 1695530765 ecr 468532980,nop,wscale 1], length 0
09:02:56.049717 00:1b:63:cb:f8:d1 (oui Unknown) > 00:40:05:7b:f9:f4 (oui Unknown), ethertype IPv4 (0x0800), length 66: 10.167.2.70.53326 > amung.us.http: Flags [.], ack 1, win 65535, options [nop,nop,TS val 468533013 ecr 1695530765], length 0
09:02:56.522501 00:40:05:7b:f9:f4 (oui Unknown) > 00:1b:63:cb:f8:d1 (oui Unknown), ethertype IPv4 (0x0800), length 120: card.freenode.net.6667 > 10.167.2.70.53226: Flags [P.], seq 95:149, ack 1, win 108, options [nop,nop,TS val 1561911177 ecr 468532857], length 54
09:02:56.522682 00:1b:63:cb:f8:d1 (oui Unknown) > 00:40:05:7b:f9:f4 (oui Unknown), ethertype IPv4 (0x0800), length 66: 10.167.2.70.53226 > card.freenode.net.6667: Flags [.], ack 149, win 65535, options [nop,nop,TS val 468533018 ecr 1561911177], length 0
09:02:56.642055 00:40:05:7b:f9:f4 (oui Unknown) > 00:1b:63:cb:f8:d1 (oui Unknown), ethertype IPv4 (0x0800), length 192: card.freenode.net.6667 > 10.167.2.70.53226: Flags [P.], seq 149:275, ack 1, win 108, options [nop,nop,TS val 1561911206 ecr 468533018], length 126
09:02:56.642333 00:1b:63:cb:f8:d1 (oui Unknown) > 00:40:05:7b:f9:f4 (oui Unknown), ethertype IPv4 (0x0800), length 66: 10.167.2.70.53226 > card.freenode.net.6667: Flags [.], ack 275, win 65535, options [nop,nop,TS val 468533019 ecr 1561911206], length 0
09:03:02.390359 00:1b:63:cb:f8:d1 (oui Unknown) > 00:40:05:7b:f9:f4 (oui Unknown), ethertype IPv4 (0x0800), length 78: 10.167.2.70.53328 > ec2-184-73-194-227.compute-1.amazonaws.com.http: Flags [S], seq 763772475, win 65535, options [mss 1460,nop,wscale 3,nop,nop,TS val 468533076 ecr 0,sackOK,eol], length 0
09:03:02.484719 00:40:05:7b:f9:f4 (oui Unknown) > 00:1b:63:cb:f8:d1 (oui Unknown), ethertype IPv4 (0x0800), length 74: ec2-184-73-194-227.compute-1.amazonaws.com.http > 10.167.2.70.53328: Flags [S.], seq 2643310242, ack 763772476, win 5792, options [mss 1460,sackOK,TS val 177607853 ecr 468533076,nop,wscale 7], length 0
09:03:02.484778 00:1b:63:cb:f8:d1 (oui Unknown) > 00:40:05:7b:f9:f4 (oui Unknown), ethertype IPv4 (0x0800), length 66: 10.167.2.70.53328 > ec2-184-73-194-227.compute-1.amazonaws.com.http: Flags [.], ack 1, win 65535, options [nop,nop,TS val 468533077 ecr 177607853], length 0
09:03:02.484976 00:1b:63:cb:f8:d1 (oui Unknown) > 00:40:05:7b:f9:f4 (oui Unknown), ethertype IPv4 (0x0800), length 697: 10.167.2.70.53328 > ec2-184-73-194-227.compute-1.amazonaws.com.http: Flags [P.], seq 1:632, ack 1, win 65535, options [nop,nop,TS val 468533077 ecr 177607853], length 631
09:03:02.584567 00:40:05:7b:f9:f4 (oui Unknown) > 00:1b:63:cb:f8:d1 (oui Unknown), ethertype IPv4 (0x0800), length 66: ec2-184-73-194-227.compute-1.amazonaws.com.http > 10.167.2.70.53328: Flags [.], ack 632, win 56, options [nop,nop,TS val 177607862 ecr 468533077], length 0
09:03:02.588201 00:40:05:7b:f9:f4 (oui Unknown) > 00:1b:63:cb:f8:d1 (oui Unknown), ethertype IPv4 (0x0800), length 292: ec2-184-73-194-227.compute-1.amazonaws.com.http > 10.167.2.70.53328: Flags [P.], seq 1:227, ack 632, win 56, options [nop,nop,TS val 177607862 ecr 468533077], length 226
09:03:02.588304 00:1b:63:cb:f8:d1 (oui Unknown) > 00:40:05:7b:f9:f4 (oui Unknown), ethertype IPv4 (0x0800), length 66: 10.167.2.70.53328 > ec2-184-73-194-227.compute-1.amazonaws.com.http: Flags [.], ack 227, win 65535, options [nop,nop,TS val 468533078 ecr 177607862], length 0
09:03:02.588850 00:40:05:7b:f9:f4 (oui Unknown) > 00:1b:63:cb:f8:d1 (oui Unknown), ethertype IPv4 (0x0800), length 66: ec2-184-73-194-227.compute-1.amazonaws.com.http > 10.167.2.70.53328: Flags [F.], seq 227, ack 632, win 56, options [nop,nop,TS val 177607862 ecr 468533077], length 0
09:03:02.588892 00:1b:63:cb:f8:d1 (oui Unknown) > 00:40:05:7b:f9:f4 (oui Unknown), ethertype IPv4 (0x0800), length 66: 10.167.2.70.53328 > ec2-184-73-194-227.compute-1.amazonaws.com.http: Flags [F.], seq 632, ack 227, win 65535, options [nop,nop,TS val 468533078 ecr 177607862], length 0
09:03:02.588950 00:1b:63:cb:f8:d1 (oui Unknown) > 00:40:05:7b:f9:f4 (oui Unknown), ethertype IPv4 (0x0800), length 66: 10.167.2.70.53328 > ec2-184-73-194-227.compute-1.amazonaws.com.http: Flags [F.], seq 632, ack 228, win 65535, options [nop,nop,TS val 468533078 ecr 177607862], length 0
09:03:02.683569 00:40:05:7b:f9:f4 (oui Unknown) > 00:1b:63:cb:f8:d1 (oui Unknown), ethertype IPv4 (0x0800), length 66: ec2-184-73-194-227.compute-1.amazonaws.com.http > 10.167.2.70.53328: Flags [.], ack 633, win 56, options [nop,nop,TS val 177607872 ecr 468533078], length 0
09:03:02.683616 00:1b:63:cb:f8:d1 (oui Unknown) > 00:40:05:7b:f9:f4 (oui Unknown), ethertype IPv4 (0x0800), length 66: 10.167.2.70.53328 > ec2-184-73-194-227.compute-1.amazonaws.com.http: Flags [.], ack 228, win 65535, options [nop,nop,TS val 468533079 ecr 177607872], length 0
09:03:03.270425 00:1b:63:cb:f8:d1 (oui Unknown) > 00:11:11:49:5b:d6 (oui Unknown), ethertype IPv4 (0x0800), length 87: 10.167.2.70.62342 > 10.167.2.68.domain: 16345+ PTR? 227.194.73.184.in-addr.arpa. (45)
09:03:03.330606 00:11:11:49:5b:d6 (oui Unknown) > 00:1b:63:cb:f8:d1 (oui Unknown), ethertype IPv4 (0x0800), length 143: 10.167.2.68.domain > 10.167.2.70.62342: 16345 1/0/0 PTR ec2-184-73-194-227.compute-1.amazonaws.com. (101)
09:03:09.142006 00:1e:c2:bd:64:9b (oui Unknown) > Broadcast, ethertype IPv4 (0x0800), length 148: 10.167.2.121.17500 > broadcasthost.17500: UDP, length 106
09:03:09.143986 00:1e:c2:bd:64:9b (oui Unknown) > Broadcast, ethertype IPv4 (0x0800), length 148: 10.167.2.121.17500 > 10.167.2.127.17500: UDP, length 106
09:03:09.862954 00:40:05:7b:f9:f4 (oui Unknown) > 00:1b:63:cb:f8:d1 (oui Unknown), ethertype IPv4 (0x0800), length 264: 208.43.202.27-static.reverse.softlayer.com.http > 10.167.2.70.50616: Flags [P.], seq 3024919684:3024919882, ack 117802023, win 501, options [nop,nop,TS val 2552267196 ecr 468532410], length 198
09:03:09.863017 00:1b:63:cb:f8:d1 (oui Unknown) > 00:40:05:7b:f9:f4 (oui Unknown), ethertype IPv4 (0x0800), length 66: 10.167.2.70.50616 > 208.43.202.27-static.reverse.softlayer.com.http: Flags [.], ack 198, win 65535, options [nop,nop,TS val 468533151 ecr 2552267196], length 0
09:03:09.866970 00:1b:63:cb:f8:d1 (oui Unknown) > 00:40:05:7b:f9:f4 (oui Unknown), ethertype IPv4 (0x0800), length 812: 10.167.2.70.50616 > 208.43.202.27-static.reverse.softlayer.com.http: Flags [P.], seq 1:747, ack 198, win 65535, options [nop,nop,TS val 468533151 ecr 2552267196], length 746
09:03:09.998102 00:40:05:7b:f9:f4 (oui Unknown) > 00:1b:63:cb:f8:d1 (oui Unknown), ethertype IPv4 (0x0800), length 66: 208.43.202.27-static.reverse.softlayer.com.http > 10.167.2.70.50616: Flags [.], ack 747, win 501, options [nop,nop,TS val 2552267230 ecr 468533151], length 0
09:03:10.584708 00:1b:63:cb:f8:d1 (oui Unknown) > 00:40:05:7b:f9:f4 (oui Unknown), ethertype IPv4 (0x0800), length 66: 10.167.2.70.53326 > amung.us.http: Flags [F.], seq 1, ack 1, win 65535, options [nop,nop,TS val 468533158 ecr 1695530765], length 0
09:03:10.703308 00:40:05:7b:f9:f4 (oui Unknown) > 00:1b:63:cb:f8:d1 (oui Unknown), ethertype IPv4 (0x0800), length 56: amung.us.http > 10.167.2.70.53326: Flags [R], seq 3280556140, win 0, length 0
09:03:11.707274 00:1b:63:cb:f8:d1 (oui Unknown) > 00:40:05:7b:f9:f4 (oui Unknown), ethertype IPv4 (0x0800), length 78: 10.167.2.70.53329 > amung.us.http: Flags [S], seq 187958398, win 65535, options [mss 1460,nop,wscale 3,nop,nop,TS val 468533169 ecr 0,sackOK,eol], length 0
09:03:11.823218 00:40:05:7b:f9:f4 (oui Unknown) > 00:1b:63:cb:f8:d1 (oui Unknown), ethertype IPv4 (0x0800), length 74: amung.us.http > 10.167.2.70.53329: Flags [S.], seq 3584377101, ack 187958399, win 2896, options [mss 1460,sackOK,TS val 1695534708 ecr 468533169,nop,wscale 1], length 0
09:03:11.823591 00:1b:63:cb:f8:d1 (oui Unknown) > 00:40:05:7b:f9:f4 (oui Unknown), ethertype IPv4 (0x0800), length 66: 10.167.2.70.53329 > amung.us.http: Flags [.], ack 1, win 65535, options [nop,nop,TS val 468533171 ecr 1695534708], length 0
09:03:11.823822 00:1b:63:cb:f8:d1 (oui Unknown) > 00:40:05:7b:f9:f4 (oui Unknown), ethertype IPv4 (0x0800), length 610: 10.167.2.70.53329 > amung.us.http: Flags [P.], seq 1:545, ack 1, win 65535, options [nop,nop,TS val 468533171 ecr 1695534708], length 544
09:03:11.951740 00:40:05:7b:f9:f4 (oui Unknown) > 00:1b:63:cb:f8:d1 (oui Unknown), ethertype IPv4 (0x0800), length 1514: amung.us.http > 10.167.2.70.53329: Flags [.], seq 1:1449, ack 545, win 1992, options [nop,nop,TS val 1695534740 ecr 468533171], length 1448
09:03:11.952036 00:40:05:7b:f9:f4 (oui Unknown) > 00:1b:63:cb:f8:d1 (oui Unknown), ethertype IPv4 (0x0800), length 359: amung.us.http > 10.167.2.70.53329: Flags [F.], seq 1449:1742, ack 545, win 1992, options [nop,nop,TS val 1695534740 ecr 468533171], length 293
09:03:11.952118 00:1b:63:cb:f8:d1 (oui Unknown) > 00:40:05:7b:f9:f4 (oui Unknown), ethertype IPv4 (0x0800), length 66: 10.167.2.70.53329 > amung.us.http: Flags [.], ack 1743, win 65485, options [nop,nop,TS val 468533172 ecr 1695534740], length 0
09:03:11.952721 00:1b:63:cb:f8:d1 (oui Unknown) > 00:40:05:7b:f9:f4 (oui Unknown), ethertype IPv4 (0x0800), length 66: 10.167.2.70.53329 > amung.us.http: Flags [F.], seq 545, ack 1743, win 65535, options [nop,nop,TS val 468533172 ecr 1695534740], length 0
09:03:12.069400 00:40:05:7b:f9:f4 (oui Unknown) > 00:1b:63:cb:f8:d1 (oui Unknown), ethertype IPv4 (0x0800), length 66: amung.us.http > 10.167.2.70.53329: Flags [.], ack 546, win 1992, options [nop,nop,TS val 1695534770 ecr 468533172], length 0
09:03:15.233861 00:40:05:7b:f9:f4 (oui Unknown) > 00:1b:63:cb:f8:d1 (oui Unknown), ethertype IPv4 (0x0800), length 129: card.freenode.net.6667 > 10.167.2.70.53226: Flags [P.], seq 275:338, ack 1, win 108, options [nop,nop,TS val 1561915855 ecr 468533019], length 63
09:03:15.234110 00:1b:63:cb:f8:d1 (oui Unknown) > 00:40:05:7b:f9:f4 (oui Unknown), ethertype IPv4 (0x0800), length 66: 10.167.2.70.53226 > card.freenode.net.6667: Flags [.], ack 338, win 65535, options [nop,nop,TS val 468533205 ecr 1561915855], length 0
09:03:20.764637 00:1b:63:cb:f8:d1 (oui Unknown) > 00:40:05:7b:f9:f4 (oui Unknown), ethertype IPv4 (0x0800), length 167: 10.167.2.70.53204 > jabber.headshift.com.jabber-client: Flags [P.], seq 101:202, ack 118, win 65535, options [nop,nop,TS val 468533260 ecr 792388125], length 101
09:03:20.791869 00:40:05:7b:f9:f4 (oui Unknown) 
